{
  "schemaVersion": 1,
  "runId": "phase0-integration-local",
  "commit": "113a9000e744dd8a6c2923279e0612cd67a1af23",
  "startedAt": "2026-09-01T16:42:37.496Z",
  "finishedAt": "2026-09-01T16:44:50.106Z",
  "overallStatus": "blocked",
  "environment": {
    "windows": {
      "version": "Windows 10 Home China 22H2",
      "architecture": "x64",
      "language": "zh-CN",
      "build": "19045.7663"
    },
    "word": {
      "version": "16.0.19127.20302",
      "availability": "available",
      "bitness": "x64",
      "channel": "HomeStudent2019Retail (outside supported release matrix)",
      "language": "zh-CN"
    },
    "runtimes": [
      {
        "name": "Node.js",
        "availability": "available",
        "version": "24.18.0"
      },
      {
        "name": ".NET Framework",
        "availability": "available",
        "version": "4.8.09037 (Release 533325)"
      },
      {
        "name": ".NET",
        "availability": "available",
        "version": "10.0.11"
      },
      {
        "name": "VSTO Runtime",
        "availability": "available",
        "version": "10.0.60917"
      },
      {
        "name": "WebView2 Runtime",
        "availability": "available",
        "version": "151.0.4129.107"
      }
    ],
    "tex": {
      "installations": [
        {
          "version": "2024",
          "distribution": "TeX Live"
        }
      ],
      "availability": "available"
    },
    "signing": {
      "reason": "No signed FormulaBridge MSI or build-metadata.json is available; no current-user code-signing certificate was found.",
      "availability": "unavailable"
    }
  },
  "corpus": {
    "version": "1.3.0",
    "manifest": "inputs/corpus/manifest.json",
    "sha256": "07ae74b04bf8def28d4e102499ac2a5641e5e25358c9ca6efbdfbd40f5355e4f"
  },
  "checkSet": {
    "version": "1.7.0",
    "manifest": "inputs/check-set/checks.json",
    "sha256": "12dd18d5fc19de8e4cc6f4ba54a410158ad24877b3594d128c545686e15eee18"
  },
  "checks": [
    {
      "id": "vsto-installation",
      "name": "VSTO user-level installation and diagnostics",
      "status": "blocked",
      "startedAt": "2026-09-01T16:42:43.880Z",
      "finishedAt": "2026-09-01T16:42:43.910Z",
      "environment": {
        "windows": {
          "version": "Windows 10 Home China 22H2",
          "architecture": "x64",
          "language": "zh-CN",
          "build": "19045.7663"
        },
        "word": {
          "version": "16.0.19127.20302",
          "availability": "available",
          "bitness": "x64",
          "channel": "HomeStudent2019Retail (outside supported release matrix)",
          "language": "zh-CN"
        },
        "runtimes": [
          {
            "name": "Node.js",
            "availability": "available",
            "version": "24.18.0"
          },
          {
            "name": ".NET Framework",
            "availability": "available",
            "version": "4.8.09037 (Release 533325)"
          },
          {
            "name": ".NET",
            "availability": "available",
            "version": "10.0.11"
          },
          {
            "name": "VSTO Runtime",
            "availability": "available",
            "version": "10.0.60917"
          },
          {
            "name": "WebView2 Runtime",
            "availability": "available",
            "version": "151.0.4129.107"
          }
        ],
        "tex": {
          "installations": [
            {
              "version": "2024",
              "distribution": "TeX Live"
            }
          ],
          "availability": "available"
        },
        "signing": {
          "reason": "No signed FormulaBridge MSI or build-metadata.json is available; no current-user code-signing certificate was found.",
          "availability": "unavailable"
        }
      },
      "evidence": [
        {
          "kind": "result",
          "location": "evidence/vsto-installation/result/result.json",
          "sha256": "ca43d95d15712f21a0d59a096fabf0311c9cb6a500beedec66e65691fe6d9246",
          "sizeBytes": 1903
        },
        {
          "kind": "log",
          "location": "evidence/vsto-installation/log/smoke.log",
          "sha256": "7ca42a4a22353c3a48bbbaa9f1ca7f4d3be30576605c4e526c042c9683d8eea2",
          "sizeBytes": 85
        }
      ],
      "reason": "FORMULABRIDGE_VSTO_INSTALLER is not configured with a signed MSI"
    },
    {
      "id": "source-portable-copy",
      "name": "Source-portable ordinary copy",
      "status": "passed",
      "startedAt": "2026-09-01T16:42:51.913Z",
      "finishedAt": "2026-09-01T16:43:17.602Z",
      "environment": {
        "windows": {
          "version": "Windows 10 Home China 22H2",
          "architecture": "x64",
          "language": "zh-CN",
          "build": "19045.7663"
        },
        "word": {
          "version": "16.0.19127.20302",
          "availability": "available",
          "bitness": "x64",
          "channel": "HomeStudent2019Retail (outside supported release matrix)",
          "language": "zh-CN"
        },
        "runtimes": [
          {
            "name": "Node.js",
            "availability": "available",
            "version": "24.18.0"
          },
          {
            "name": ".NET Framework",
            "availability": "available",
            "version": "4.8.09037 (Release 533325)"
          },
          {
            "name": ".NET",
            "availability": "available",
            "version": "10.0.11"
          },
          {
            "name": "VSTO Runtime",
            "availability": "available",
            "version": "10.0.60917"
          },
          {
            "name": "WebView2 Runtime",
            "availability": "available",
            "version": "151.0.4129.107"
          }
        ],
        "tex": {
          "installations": [
            {
              "version": "2024",
              "distribution": "TeX Live"
            }
          ],
          "availability": "available"
        },
        "signing": {
          "reason": "No signed FormulaBridge MSI or build-metadata.json is available; no current-user code-signing certificate was found.",
          "availability": "unavailable"
        }
      },
      "evidence": [
        {
          "kind": "result",
          "location": "evidence/source-portable-copy/result/result.json",
          "sha256": "1a1123554b08e924c0bdb9a16d609643e70119eca651463cc9c3bcf32d8fb5a6",
          "sizeBytes": 673
        },
        {
          "kind": "log",
          "location": "evidence/source-portable-copy/log/word-automation.log",
          "sha256": "f731c34db423c8b9ccd009c04db3d22d995a2801a2440804b8d937ab80c76846",
          "sizeBytes": 197
        },
        {
          "kind": "docx-package",
          "location": "evidence/source-portable-copy/docx-package/package-evidence.zip",
          "sha256": "653c56866d0c5894dd1602154baa0730588a462eaafba6bf42bc6fb47f090902",
          "sizeBytes": 27098
        },
        {
          "kind": "word-automation",
          "location": "evidence/source-portable-copy/word-automation/word-automation.json",
          "sha256": "221ff484b415faadabedcb4c537f33ae26d6ff57ada64f021b99993a241db9d9",
          "sizeBytes": 755
        }
      ]
    },
    {
      "id": "dual-format-roundtrip",
      "name": "SVG and PNG Word round trip",
      "status": "passed",
      "startedAt": "2026-09-01T16:43:27.379Z",
      "finishedAt": "2026-09-01T16:44:27.509Z",
      "environment": {
        "windows": {
          "version": "Windows 10 Home China 22H2",
          "architecture": "x64",
          "language": "zh-CN",
          "build": "19045.7663"
        },
        "word": {
          "version": "16.0.19127.20302",
          "availability": "available",
          "bitness": "x64",
          "channel": "HomeStudent2019Retail (outside supported release matrix)",
          "language": "zh-CN"
        },
        "runtimes": [
          {
            "name": "Node.js",
            "availability": "available",
            "version": "24.18.0"
          },
          {
            "name": ".NET Framework",
            "availability": "available",
            "version": "4.8.09037 (Release 533325)"
          },
          {
            "name": ".NET",
            "availability": "available",
            "version": "10.0.11"
          },
          {
            "name": "VSTO Runtime",
            "availability": "available",
            "version": "10.0.60917"
          },
          {
            "name": "WebView2 Runtime",
            "availability": "available",
            "version": "151.0.4129.107"
          }
        ],
        "tex": {
          "installations": [
            {
              "version": "2024",
              "distribution": "TeX Live"
            }
          ],
          "availability": "available"
        },
        "signing": {
          "reason": "No signed FormulaBridge MSI or build-metadata.json is available; no current-user code-signing certificate was found.",
          "availability": "unavailable"
        }
      },
      "evidence": [
        {
          "kind": "result",
          "location": "evidence/dual-format-roundtrip/result/result.json",
          "sha256": "c23cc239c425c614ac510f8111d9a1135a7fa661e2823ec552bd53950d1d8033",
          "sizeBytes": 589
        },
        {
          "kind": "log",
          "location": "evidence/dual-format-roundtrip/log/smoke.log",
          "sha256": "284d3547ef474faae70bd5e3beccb6ec3224a3518022e89622e0933fd8d66915",
          "sizeBytes": 885
        },
        {
          "kind": "docx-package",
          "location": "evidence/dual-format-roundtrip/docx-package/roundtrip-documents.zip",
          "sha256": "a6ff6f22a9b540c14ddb088ba6a59858d6335f041166e0583af44ce8557a8326",
          "sizeBytes": 90893
        },
        {
          "kind": "pdf",
          "location": "evidence/dual-format-roundtrip/pdf/word-export.pdf",